,Headers,Descriptions
0,"A Minecraft Player Set Out to Build the Known Universe, Block by Block","Christopher Slayton, 18, spent two months intricately designing the planets. He even went skydiving to get a better appreciation for Earth."
1,"Under New Order, Europeans Can Complain to U.S. About Data Collection","An executive order, signed by President Biden, brings the United States and the European Union closer to a broader deal on the transfer of digital data."
2,Elon’s Hidden Motives + A Meetup in the Metaverse,Is the $44 billion  Twitter deal actually for real this time? Our hosts disagree.
3,This Is Life in the Metaverse,"Every hour of the day and night with the gamers, parents, insomniacs, preteens and aspiring comedians who are the earliest adopters of the immersive, three-dimensional internet that Mark Zuckerberg has bet the future of his company on."
4,Biden Visits IBM to Promote Investments in U.S. Semiconductor Production,"President Biden traveled to Poughkeepsie, N.Y., to connect a $20 billion investment by IBM to the bipartisan bill meant to spur production of critical microchips."
5,Judge Grants Elon Musk’s Request to Delay Trial With Twitter,"A judge in Delaware gave Mr. Musk until Oct. 28 to complete the deal. The trial, which was set to start in a little more than a week, could still happen in November."
6,What Does X Mean to Elon Musk?,"The letter X has had significance in the billionaire’s life, from his early days as an entrepreneur to his personal life and now to his pursuit of Twitter."
7,"News on Fringe Social Sites Draws Limited but Loyal Fans, Report Finds","The appeal of platforms like Parler, Truth Social and Telegram is another symptom of the partisan divide in media, according to the Pew Research Center."
8,Elon Musk Offered to Buy Twitter at a Lower Price in Recent Talks,"Before Mr. Musk renewed his $44 billion proposal, he and the company haggled in discussions that ultimately did not advance."
9,Former Uber Security Chief Found Guilty of Hiding Hack From Authorities,"A jury found Joe Sullivan, who led security at the ride-hailing company, guilty on two different counts. The case could change how security professionals handle data breaches."
